{
  "id": "G-CHECKPOINT",
  "run": "r-2026-08-02-ex01",
  "stage": "implement",
  "shape": "approve",
  "blocking": true,
  "prompt": "Task 4 wants to run `helm upgrade aurora-api` against the shared staging namespace, which is outside this run's lease. Approve this checkpoint task?",
  "context": {
    "tripwire": "shared-namespace",
    "verb": "helm upgrade",
    "target": "namespace/staging",
    "lease": "none",
    "reversible": "rollback via `helm rollback aurora-api 41`"
  },
  "status": "open",
  "answer": null
}
