{
  "id": "G-CLASS",
  "run": "r-2026-08-02-ex01",
  "stage": "route",
  "shape": "choice",
  "blocking": true,
  "prompt": "Classified this request as `fix` (a failing journal write on full disks). Confirm the class, or pick another.",
  "context": {
    "request": "journal.jsonl writes silently drop lines when the runs volume is full",
    "classifier_answers": {
      "known_broken_behavior": true,
      "user_facing_change": false,
      "urgent_live_impact": false,
      "answer_or_artifact": "artifact"
    },
    "proposed": "fix"
  },
  "items": ["chore", "fix", "probe", "incident", "feature"],
  "status": "open",
  "answer": null
}
